link,header,time,thumbnail,summary,date
/news-releases/dewalt-r-es-la-primera-de-las-grandes-marcas-de-herramientas-electricas-en-el-mundo-que-ofrecera-baterias-de-celdas-planas-apilables-disenadas-para-la-industria-de-la-construccion-lo-que-marca-una-nueva-era-de-desempeno-para-las-herramienta-896831464.html,"DEWALT® es la primera de las grandes marcas de herramientas eléctricas en el mundo, que ofrecerá baterías de celdas planas apilables, diseñadas para la industria de la construcción, lo que marca una nueva era de desempeño para las herramientas inalámbricas DEWALT.",2021-11-16 08:00:00,,"DEWALT®, una marca de Stanley Black & Decker (NYSE: SWK) y líder en soluciones de todo tipo para las obras de construcción, anunció hoy el...",2021-11-16
/news-releases/usd-1-67-bn-growth-in-left-atrial-appendage-closure-market--featuring-abbott-laboratories-append-medical-and-atricure-inc-among-others--technavio-301424276.html,"USD 1.67 Bn growth in Left Atrial Appendage Closure Market | Featuring Abbott Laboratories, Append Medical, and AtriCure Inc. among others | Technavio",2021-11-16 08:00:00,https://mma.prnewswire.com/media/1688512/Global_Left_Atrial_Appendage_Closure_Market.jpg?p=thumbnail,"The ""Left Atrial Appendage Closure Market by Product and Geography - Forecast and Analysis 2021-2025"" report has been added to Technavio's offering....",2021-11-16
/news-releases/global-shea-butter-market-expected-to-generate-a-revenue-of-2-281-864-90-thousand-by-2028--growing-at-a-cagr-of-14-0-from-2021-to-2028---exclusive-covid-19-impact-analysis-144-pages-report-by-research-dive-301424883.html,"Global Shea Butter Market Expected to Generate a Revenue of $2,281,864.90 thousand by 2028, Growing at a CAGR of 14.0% From 2021 to 2028 - Exclusive COVID-19 Impact Analysis [144 Pages] Report by Research Dive",2021-11-16 08:00:00,https://mma.prnewswire.com/media/997523/Research_Dive_Logo.jpg?p=thumbnail,"Research Dive has added a new report to its offering titled, ""Shea Butter Market by Type (Unrefined and Refined), Application (Cosmetics & Personal...",2021-11-16
/news-releases/protinhi-therapeutics-selected-as-part-of-blue-knight-collaboration-for-pandemic-preparedness-301424685.html,Protinhi Therapeutics selected as part of BLUE KNIGHT™ collaboration for pandemic preparedness,2021-11-16 08:00:00,,"Protinhi Therapeutics, a Netherlands-based biotechnology company specializing in protease inhibition with the aim to combat viral infectious...",2021-11-16
/news-releases/gastroenterologists-report-challenges-treating-eosinophilic-esophagitis-as-new-therapies-inch-closer-to-fda-approval-according-to-spherix-global-insights-301424844.html,"Gastroenterologists Report Challenges Treating Eosinophilic Esophagitis as New Therapies Inch Closer to FDA Approval, According to Spherix Global Insights",2021-11-16 08:00:00,https://mma.prnewswire.com/media/409472/Spherix_Global_Insights_Logo.jpg?p=thumbnail,Spherix recently surveyed 101 US gastroenterologists and followed up with ten qualitative interviews (including four with industry key opinion...,2021-11-16
/news-releases/semantic-health-announces-multi-year-contract-with-sickkids-301424650.html,Semantic Health Announces Multi-Year Contract with SickKids,2021-11-16 08:00:00,https://mma.prnewswire.com/media/1688638/Semantic_Health_Pediatrics__SickKids_2.jpg?p=thumbnail,"SickKids procures Semantic Health's AI-assisted coding and auditing platform to improve data quality and coder productivity TORONTO, Nov. 16, 2021...",2021-11-16
/news-releases/robotic-kitchen-nommi-partners-with-sam-nazarian-and-his-leading-global-food-tech-platform-c3-301424935.html,Robotic Kitchen Nommi Partners with Sam Nazarian and his Leading Global Food Tech Platform C3,2021-11-16 08:00:00,https://mma.prnewswire.com/media/1689216/Nommi_machine.jpg?p=thumbnail,"Today, Nommi, a new startup automating customizable bowl-based meals, has launched to raise up to $20M in seed capital and is now open for...",2021-11-16
/news-releases/boehringer-ingelheims-carine-boustany-appointed-to-bio-board-301424734.html,Boehringer Ingelheim's Carine Boustany Appointed to BIO Board,2021-11-16 08:00:00,https://mma.prnewswire.com/media/354630/Boehringer_Ingelheim_Pharmaceuticals_Inc___Logo.jpg?p=thumbnail,"Boehringer Ingelheim announced today that Carine Boustany, Ph.D., Global Head, Development Science + Head, Development Site U.S., has been appointed...",2021-11-16
/news-releases/e-pluribus-unum-awards-fellowships-to-southern-state-legislators-301424680.html,E Pluribus Unum Awards Fellowships to Southern State Legislators,2021-11-16 08:00:00,https://mma.prnewswire.com/media/1306041/EPluribusUnum_Logo.jpg?p=thumbnail,"Today, E Pluribus Unum (EPU) announced the 11 state legislators chosen as 2021 UNUM Fellows. The select cohort of Southern elected leaders will...",2021-11-16
/news-releases/atrial-fibrillation-market-growth-driven-by-technological-advancements-in-afib-systems-and-solutions-and-rapidly-increasing-geriatric-population--reports-and-data-301425087.html,Atrial Fibrillation Market Growth Driven by Technological Advancements in AFib Systems and Solutions and Rapidly Increasing Geriatric Population - Reports and Data,2021-11-16 08:00:00,https://mma.prnewswire.com/media/1579615/Reports_and_Data_Logo.jpg?p=thumbnail,"The global atrial fibrillation market size is expected to reach USD 2.11 billion in 2028 and register a CAGR of 6.4% during the forecast period,...",2021-11-16
/news-releases/global-digital-twin-market-research-report-2021-to-2026---by-type-industry-application-and-region-301425165.html,"Global Digital Twin Market Research Report (2021 to 2026) - by Type, Industry, Application and Region",2021-11-16 08:00:00,http://mma.prnewswire.com/media/539438/Research_and_Markets_Logo.jpg?p=thumbnail,"The ""Digital Twin Market Research Report by Type, Industry, Application, and Region - Global Forecast to 2026 - Cumulative Impact of COVID-19"" report ...",2021-11-16
/news-releases/dynabook-upgrades-satellite-pro-laptop-series-301425237.html,Dynabook Upgrades Satellite Pro™ Laptop Series,2021-11-16 08:00:00,https://mma.prnewswire.com/media/1689225/Dynabook_Americas_Inc_Logo.jpg?p=thumbnail,"Dynabook Americas, Inc., formerly Toshiba PC Company, today announced the expansion of its Satellite Pro™ product line with the addition of the...",2021-11-16
/news-releases/global-life-science-analytics-market-size-worth-14-15-billion-by-2028--cagr-7-9-polaris-market-research-301425215.html,Global Life Science Analytics Market Size Worth $14.15 Billion By 2028 | CAGR: 7.9%: Polaris Market Research,2021-11-16 08:00:00,https://mma.prnewswire.com/media/1316207/Polaris_Market_Research_Logo.jpg?p=thumbnail,The global life science analytics market size is expected to reach USD 14.15 billion by 2028 according to a new study conducted by Polaris Market...,2021-11-16
/news-releases/firefighting-aircraft-market-to-reach-16-46-billion-globally-by-2030-at-6-5-cagr-allied-market-research-301425240.html,"Firefighting Aircraft Market to Reach $16.46 Billion, Globally, by 2030 at 6.5% CAGR: Allied Market Research",2021-11-16 08:00:00,https://mma.prnewswire.com/media/636519/Allied_Market_Research_Logo.jpg?p=thumbnail,"Allied Market Research recently published a report, titled, ""Firefighting Aircraft Market by Type (Fixed Wing and Multi-Rotor), Service Provider...",2021-11-16
/news-releases/hollow-fiber-filtration-market-size-to-reach-usd-374-3-million-by-2027-at-cagr-7-5---valuates-reports-301425162.html,Hollow Fiber Filtration Market Size to Reach USD 374.3 Million by 2027 at CAGR 7.5% - Valuates Reports,2021-11-16 08:00:00,https://mma.prnewswire.com/media/1082232/Valuates_Reports_Logo.jpg?p=thumbnail,"The Hollow Fiber Filtration Market is Segmented by Type (Microfiltration, Ultrafiltration), Application (Pharmaceutical and Biotechnology...",2021-11-16
/news-releases/government-push-to-biofuel-production-will-enable-isoprenol-market-surpass-us-375-mn-by-2031-301425276.html,Government Push to Biofuel Production will Enable Isoprenol Market Surpass US$ 375 Mn by 2031,2021-11-16 08:00:00,https://mma.prnewswire.com/media/713666/FactMR_Logo.jpg?p=thumbnail,"As per the newly released data by Fact.MR, the global isoprenol market is estimated to surpass a valuation of US$ 200 Mn by 2021. The overall market...",2021-11-16
/news-releases/mediamath-appoints-mary-matyas-as-svp-general-manager-north-americas-301424694.html,"MediaMath Appoints Mary Matyas as SVP, General Manager North Americas",2021-11-16 08:00:00,https://mma.prnewswire.com/media/1688657/Mary_Matyas.jpg?p=thumbnail,"MediaMath, acclaimed independent advertising technology company for leading brands and agencies, has announced Mary Matyas as SVP, General Manager...",2021-11-16
/news-releases/wondershare-releases-repairit-v3-5-with-new-file-repair-features-301424821.html,Wondershare Releases Repairit V3.5 with New File Repair Features,2021-11-16 08:00:00,https://mma.prnewswire.com/media/1688092/Repairit_file_repair.jpg?p=thumbnail,"Creative software company, Wondershare Technology has announced the launch of Wondershare Repairit Version 3.5, which contains a new feature for file ...",2021-11-16
/news-releases/dicks-sporting-goods-announces-participation-in-the-morgan-stanley-virtual-global-consumer--retail-conference-301424631.html,DICK'S Sporting Goods Announces Participation in the Morgan Stanley Virtual Global Consumer & Retail Conference,2021-11-16 08:00:00,https://mma.prnewswire.com/media/479785/DICKS_Sporting_Goods_Logo.jpg?p=thumbnail,"DICK'S Sporting Goods, Inc. (NYSE: DKS) today announced that management will present at the Morgan Stanley Virtual Global Consumer & Retail...",2021-11-16
/news-releases/thycoticcentrify-report-57-of-organizations-suffered-security-incidents-related-to-exposed-secrets-in-devops-301425193.html,ThycoticCentrify Report: 57% of Organizations Suffered Security Incidents Related to Exposed Secrets in DevOps,2021-11-16 08:00:00,,"ThycoticCentrify, a leading provider of cloud identity security solutions formed by the merger of the privileged access management (PAM) leaders...",2021-11-16
/news-releases/thompson-partners-with-feeding-charlotte-to-provide-food-rescue-and-community-support-301424952.html,Thompson Partners with Feeding Charlotte to Provide Food Rescue and Community Support,2021-11-16 08:00:00,https://mma.prnewswire.com/media/1561249/Thompson_Child_Family_Focus_logo.jpg?p=thumbnail,"Thompson Child & Family Focus (Thompson), in collaboration with local non-profit food rescue organization Feeding Charlotte, is expanding reach and...",2021-11-16
/news-releases/dreamtrips-international-acquires-the-exclusive-rights-to-sell-dreamtrips-globally-301425268.html,DreamTrips International Acquires the Exclusive Rights to Sell DreamTrips® Globally,2021-11-16 08:00:00,https://mma.prnewswire.com/media/1689240/DreamTrips.jpg?p=thumbnail,"Verona International Holdings, Inc. is pleased to announce that the United States Bankruptcy Court for the Eastern District of Texas entered an order ...",2021-11-16
/news-releases/otp-group-adopts-fico-originations-solution-as-standard-across-europe-301425282.html,OTP Group Adopts FICO Originations Solution as Standard Across Europe,2021-11-16 08:00:00,https://mma.prnewswire.com/media/450763/FICO_Logo.jpg?p=thumbnail,Highlights: FICO® Originations Solution will allow OTP Group to respond quicker to changing market needs and regulations FICO's experience with cloud ...,2021-11-16
/news-releases/cns-pharmaceuticals-to-present-at-the-virtual-investor-roundtable-event-301425118.html,CNS Pharmaceuticals to Present at the Virtual Investor Roundtable Event,2021-11-16 08:00:00,https://mma.prnewswire.com/media/1120277/CNS_Pharmaceuticals_Logo.jpg?p=thumbnail,"CNS Pharmaceuticals, Inc. (NASDAQ: CNSP) (""CNS"" or the ""Company""), a biopharmaceutical company specializing in the development of novel treatments...",2021-11-16
/news-releases/evaporation-test-work-underway-at-hmn-li-project-301424993.html,Evaporation Test Work Underway at HMN Li Project,2021-11-16 08:00:00,,"Lithium South Development Corporation (the ""Company"") (TSX-V: LIS) (OTCQB: LISMF) (Frankfurt OGPQ). The Company is pleased to provide an update on...",2021-11-16
/news-releases/fujifilm-healthcare-europe-deploys-servicemax-to-support-outcome-based-medical-solutions-301425234.html,FUJIFILM Healthcare Europe Deploys ServiceMax To Support Outcome-Based Medical Solutions,2021-11-16 08:00:00,https://mma.prnewswire.com/media/817210/ServiceMax_Logo.jpg?p=thumbnail,"ServiceMax, Inc., a leader in asset-centric field service management, today announced that FUJIFILM Healthcare Europe has selected and deployed...",2021-11-16
/news-releases/ribbon-significantly-expands-agreement-with-westcon-comstor-in-asia-pacific-region-301425174.html,Ribbon Significantly Expands Agreement with Westcon-Comstor in Asia Pacific Region,2021-11-16 08:00:00,https://mma.prnewswire.com/media/633020/Ribbon_Communications_Logo.jpg?p=thumbnail,"Ribbon Communications Inc. (Nasdaq: RBBN), a global provider of real time communications software and IP optical networking solutions to service...",2021-11-16
/news-releases/anchore-welcomes-josh-bressers-as-vice-president-of-security-301425242.html,Anchore Welcomes Josh Bressers as Vice President of Security,2021-11-16 08:00:00,,"Anchore, a leader in software supply chain security, today announced that Josh Bressers has joined the company as vice president of security. In this ...",2021-11-16
/news-releases/vechain-foundation-just-announced-the-2nd-term-steering-committee-election-301425080.html,VeChain Foundation Just Announced The 2nd Term Steering Committee Election,2021-11-16 08:00:00,https://mma.prnewswire.com/media/1689511/CREAM.jpg?p=thumbnail,"An exemplary governance model for an enterprise-grade public blockchain requires a specific set of qualities: transparency, integrity, and...",2021-11-16
/news-releases/women-leaders-in-the-mega-yacht-chartering-industry-valef-yachts-announces-a-generational-change-301425203.html,,2021-11-16 08:00:00,https://mma.prnewswire.com/media/1689468/Valef_Yachts.jpg?p=thumbnail,"The success story of the family business Valef Yachts, Greece's first yacht charter company founded back in 1969, writes a new chapter. The...",2021-11-16
/news-releases/lidl-releases-pricing-for-thanksgiving-basket-shoppers-can-buy-traditional-holiday-meal-for-less-than-30-301425265.html,Lidl Releases Pricing For Thanksgiving Basket; Shoppers Can Buy Traditional Holiday Meal For Less Than $30,2021-11-16 08:00:00,,"Ahead of the holiday season, Lidl has released pricing for a traditional Thanksgiving basket allowing shoppers to assemble a holiday meal for less...",2021-11-16
/news-releases/e-retailers-seen-as-most-trusted-among-all-retailers-according-to-holiday-shoppers-301425238.html,E-Retailers Seen as Most Trusted Among All Retailers According to Holiday Shoppers,2021-11-16 08:00:00,https://mma.prnewswire.com/media/1636344/Iris_Generali_Logo.jpg?p=thumbnail,"Iris® powered by Generali (""Iris""), provider of a proprietary identity and cyber protection platform, today released the findings of its fifth annual ...",2021-11-16
/news-releases/spectra7-announces-tsxv-conditional-approval-of-proposed-debenture-amendments-301425278.html,Spectra7 Announces TSXV Conditional Approval of Proposed Debenture Amendments,2021-11-16 08:00:00,https://mma.prnewswire.com/media/1421651/Spectra7_Logo.jpg?p=thumbnail,"(TSXV:SEV) (OTCQB:SPVNF) Spectra7 Microsystems Inc. (""Spectra7"" or the ""Company""), a leading provider of high-performance analog semiconductor...",2021-11-16
/news-releases/dolly-varden-silver-begins-trading-on-the-otcqx-301425168.html,Dolly Varden Silver Begins Trading on the OTCQX,2021-11-16 08:00:00,https://mma.prnewswire.com/media/1689186/Dolly_Varden_Silver_Corp__Dolly_Varden_Silver_Begins_Trading_on.jpg?p=thumbnail,"VANCOUVER, BC, Nov. 16, 2021 /PRNewswire/ - Dolly Varden Silver Corporation (""Dolly Varden"" or the ""Company"") (TSXV: DV) (OTCQX: DOLLF), is pleased...",2021-11-16
/news-releases/parata-systems-announces-company-leadership-additions-supporting-targeted-customer-needs-strategic-innovation-301425142.html,"Parata Systems Announces Company Leadership Additions Supporting Targeted Customer Needs, Strategic Innovation",2021-11-16 08:00:00,https://mma.prnewswire.com/media/1154779/Parata2019_Symbol_Logo.jpg?p=thumbnail,Parata Systems is excited to announce the expansion of the Company's leadership team through the addition of two pharmacy and health technology...,2021-11-16
/news-releases/mcdonalds-usa-serves-up-popular-fan-hacks-for-the-egg-mcmuffin-to-enjoy-with-one-day-only-offer-301424913.html,McDonald's® USA Serves Up Popular Fan Hacks for the Egg McMuffin® to Enjoy with One-Day-Only Offer,2021-11-16 08:00:00,https://mma.prnewswire.com/media/1689283/McDonalds_Egg_McMuffin_Hacks.jpg?p=thumbnail,"There is nothing tastier than a freshly cracked egg on a toasted English Muffin, topped with real butter, delicious Canadian bacon and melty...",2021-11-16
/news-releases/lodging-dynamics-expands-portfolio-into-florida-301424988.html,Lodging Dynamics Expands Portfolio Into Florida,2021-11-16 08:00:00,https://mma.prnewswire.com/media/1689022/Lodging_Dynamics_Residence_Inn_SpringHill.jpg?p=thumbnail,"Lodging Dynamics Hospitality Group (Lodging Dynamics), a leading hotel management company, has been appointed to manage the dual-branded Residence...",2021-11-16
/news-releases/happiness-development-group-limited-received-nasdaq-notification-letter-regarding-bid-price-deficiency-301425116.html,Happiness Development Group Limited Received Nasdaq Notification Letter Regarding Bid Price Deficiency,2021-11-16 08:00:00,,"Happiness Development Group Limited (""HAPP"" or the ""Company""), (NASDAQ: HAPP) announced today that the Company received a notification letter from...",2021-11-16
/news-releases/making-your-holiday-viewing-time-a-bit-merrier-with-faster-easier-access-to-alaska-airlines-huge-selection-of-onboard-entertainment-301425113.html,"Making your holiday (viewing) time a bit merrier with faster, easier access to Alaska Airlines' huge selection of onboard entertainment",2021-11-16 08:00:00,https://mma.prnewswire.com/media/1688815/Alaska_Airlines_flights.jpg?p=thumbnail,"Just in time for that trip to grandma's house this holiday season, Alaska Airlines has made it easier than ever to make the most of your time in the...",2021-11-16
/news-releases/equalweb-expands---opens-new-offices-in-tel-aviv-301425007.html,EqualWeb Expands - Opens New Offices in Tel Aviv,2021-11-16 08:00:00,,"EqualWeb, the leading digital accessibility development company, has opened its new offices in Tel Aviv on Monday. With offices already in New York...",2021-11-16
/news-releases/healthlynked-reports-98-year-over-year-revenue-growth-for-third-quarter-2021-66-growth-year-to-date-301425090.html,"HealthLynked Reports 98% Year-Over-Year Revenue Growth for Third Quarter 2021, 66% Growth Year-to-Date",2021-11-16 08:00:00,,"HealthLynked Corp. (OTCQB: HLYK), a global healthcare network focused on care management of its members and a provider of healthcare technologies...",2021-11-16
/news-releases/pistil-data-closes-6-5m-seed-round-led-by-casa-verde-301425094.html,Pistil Data Closes $6.5M Seed Round Led by Casa Verde,2021-11-16 08:00:00,https://mma.prnewswire.com/media/1688764/Pistil_Data_Pistil_Data_Closes__6_5M_Seed_Round_Led_by_Casa_Verd.jpg?p=thumbnail,"Funding Fuels Nationwide Expansion of New Cannabis Market Intelligence Category SAN FRANCISCO, Calif., Nov. 16, 2021 /PRNewswire/ - Pistil Data, the...",2021-11-16
/news-releases/in-good-conscience-launches-its-culturally-sustainable-body-care-line-301424994.html,In Good Conscience Launches its Culturally Sustainable Body Care Line,2021-11-16 08:00:00,https://mma.prnewswire.com/media/1689144/In_Good_Conscience_body_wash_product_line.jpg?p=thumbnail,"In Good Conscience, a modern, purpose-driven personal care brand, announces the launch of its first assortment of body wash products, in all-natural...",2021-11-16
/news-releases/reaching-new-heights-women-in-aviation-soaring-high-at-auburn-university-301424860.html,Reaching new heights: Women in aviation soaring high at Auburn University,2021-11-16 08:00:00,https://mma.prnewswire.com/media/1688917/Aviation_Auburn_University.jpg?p=thumbnail,"Before taking flight for an annual air race this summer, Auburn University's three teams of female pilots were treated to a rally hosted by the...",2021-11-16
/news-releases/autonation-opens-ninth-autonation-usa-store-second-in-phoenix-market-301425169.html,"AutoNation Opens Ninth AutoNation USA Store, Second in Phoenix Market",2021-11-16 08:00:00,https://mma.prnewswire.com/media/606599/AutoNation_Logo.jpg?p=thumbnail,"Building on its commitment to a superior Customer experience and consumer choice for pre-owned vehicles, AutoNation, Inc. (NYSE: AN) today announced...",2021-11-16
/news-releases/hadley-provides-access-to-practical-help-for-visually-impaired-residents-across-rural-america-301425149.html,Hadley Provides Access to Practical Help for Visually Impaired Residents Across Rural America,2021-11-16 08:00:00,,"More than 60 million people, or one in five Americans, live in rural areas of the country. Residents of rural communities face different challenges...",2021-11-16
/news-releases/neighborhood-forward-joins-national-ev-charging-initiative-301424982.html,Neighborhood FORWARD Joins National EV Charging Initiative,2021-11-16 08:00:00,,"In order to hold federal lawmakers accountable for the disproportionate impact of air pollution from cars on communities of color, Neighborhood...",2021-11-16
/news-releases/target-corporation-to-webcast-3nd-quarter-earnings-301425037.html,Target Corporation to Webcast 3nd Quarter Earnings,2021-11-16 08:00:00,https://mma.prnewswire.com/media/597598/Target_Corporation___Logo.jpg?p=thumbnail,"WHAT: Target Corporation's (NYSE:TGT) webcast of its third quarter earnings conference call. WHEN: Wednesday, November 17, 2021 - 7:00 a.m. central...",2021-11-16
/news-releases/global-food-companies-ranked-in-first-international-cage-free-equity-index-301425042.html,Global Food Companies Ranked in First International Cage-Free Equity Index,2021-11-16 08:00:00,https://mma.prnewswire.com/media/1624284/Mercy_For_Animals_Logo.jpg?p=thumbnail,"Mercy For Animals, in partnership with a coalition of animal protection organizations, released the inaugural International Cage-Free Equity Index....",2021-11-16
/news-releases/cryptyde-inc-announces-the-usage-of-social-media-as-a-public-information-source-301424979.html,"Cryptyde, Inc. Announces the Usage of Social Media as a Public Information Source",2021-11-16 08:00:00,,"Cryptyde, Inc. (which is expected to trade eventually under NASDAQ:TYDE), a selective acquisitions company focused on leveraging blockchain...",2021-11-16
/news-releases/inovio-collaborates-with-guardrx-and-geneva-university-hospitals-for-heterologous-booster-clinical-trial-of-its-ebola-dna-vaccine-candidate-ino-4201-301425217.html,"INOVIO Collaborates with GuardRX and Geneva University Hospitals for Heterologous Booster Clinical Trial of its Ebola DNA Vaccine Candidate, INO-4201",2021-11-16 08:00:00,,"INOVIO (NASDAQ: INO), a biotechnology company focused on bringing to market precisely designed DNA medicines to treat and protect people from...",2021-11-16
/news-releases/fs-investments-hires-barry-schanker-as-head-of-wealth-solutions-301425248.html,FS Investments Hires Barry Schanker as Head of Wealth Solutions,2021-11-16 08:00:00,https://mma.prnewswire.com/media/1098246/FS_Logo.jpg?p=thumbnail,"FS Investments, a leading alternative asset manager, today announced that Barry Schanker has joined the firm as Head of Wealth Solutions and Managing ...",2021-11-16
/news-releases/knowbe4-completes-acquisition-of-securityadvisor-and-cements-vision-for-the-future-of-the-human-defense-layer-for-cybersecurity-301425271.html,KnowBe4 Completes Acquisition of SecurityAdvisor and Cements Vision For the Future of the Human Defense Layer for Cybersecurity,2021-11-16 08:00:00,https://mma.prnewswire.com/media/588691/KB4_Logo.jpg?p=thumbnail,"KnowBe4, the provider of the world's largest security awareness training and simulated phishing platform, today announced that it has officially...",2021-11-16
/news-releases/women-of-color-continue-to-lose-ground-in-the-workplace-despite-companies-efforts-to-attract-and-retain-them-according-to-new-study-from-the-billie-jean-king-leadership-initiative-and-nformation-301425272.html,"Women of Color Continue to Lose Ground in the Workplace, Despite Companies' Efforts to Attract and Retain Them, According to New Study from the Billie Jean King Leadership Initiative and nFormation",2021-11-16 08:00:00,https://mma.prnewswire.com/media/1689583/PowHER_Redefined.jpg?p=thumbnail,"Today's workplace does not equitably support, endorse or promote Women of Color (WOC), according to an in-depth new report by the Billie Jean King...",2021-11-16
/news-releases/viola-israels-largest-tech-investment-group-appoints-partner-from-the-executive-search-industry-to-lead-human-capital-and-establish-the-fund-as-a-talent-first-powerhouse-301425123.html,"Viola, Israel's Largest Tech Investment Group, Appoints Partner From The Executive Search Industry to Lead Human Capital and Establish the Fund as a Talent-First Powerhouse",2021-11-16 08:00:00,https://mma.prnewswire.com/media/1689461/Jeff_Shapiro_Partner_Human_Capital_Viola.jpg?p=thumbnail,"Viola, Israel's largest tech investment group, today announced that Jeff Shapiro will be joining the firm as Partner and new Human Capital Operation...",2021-11-16
