link,header,time,thumbnail,summary,date
/news-releases/kraton-corporation-announces-price-increase-for-cto-refinery-products-and-derivatives-301425150.html,Kraton Corporation Announces Price Increase For CTO Refinery Products And Derivatives,2021-11-16 07:00:00,https://mma.prnewswire.com/media/450318/kraton_corporation_logo.jpg?p=thumbnail,"Kraton Corporation (NYSE: KRA), a leading global sustainable producer of specialty polymers and high-value bio-based products derived from pine wood...",2021-11-16
/news-releases/guardknox-and-carota-partner-to-offer-end-to-end-ota-and-cybersecurity-solutions-301425108.html,GuardKnox and Carota Partner to Offer End-to-End OTA and Cybersecurity Solutions,2021-11-16 07:00:00,,"GuardKnox, an automotive technology company building high-performance, secure-by-design products for the next generation of mobility, and Carota, a...",2021-11-16
/news-releases/ge-aviation-materials-selects-avair-for-asset-management-301425101.html,GE Aviation Materials Selects AvAir for Asset Management,2021-11-16 07:00:00,https://mma.prnewswire.com/media/1689320/GE_Aviation_Materials.jpg?p=thumbnail,"AvAir, an industry-leading inventory solutions provider for the aviation aftermarket, has been selected by GE Aviation Materials (GEAM) for an asset...",2021-11-16
/news-releases/holiday-travel-in-2021-to-increase-with-70-of-americans-planning-to-take-a-road-trip-301425158.html,Holiday Travel In 2021 To Increase With 70% Of Americans Planning To Take A Road Trip,2021-11-16 07:00:00,https://mma.prnewswire.com/media/1689006/Motel_6_Holiday_Survey_Infographic.jpg?p=thumbnail,"Motel 6 today releases its fourth annual holiday survey, revealing that nearly seven in 10 (70%) of those planning to travel for the holidays this...",2021-11-16
/news-releases/ineo-files-new-patent-application-301425054.html,INEO Files New Patent Application,2021-11-16 07:00:00,https://mma.prnewswire.com/media/1689390/INEO_Tech_Corp__INEO_Files_New_Patent_Application.jpg?p=thumbnail,"INEO strengthens its patent portfolio with new patent filing broadening its proprietary Welcoming System technology SURREY, BC, Nov. 16, 2021...",2021-11-16
/news-releases/revolution-capital-acquires-grand-financial-new-york-301425159.html,Revolution Capital Acquires Grand Financial New York,2021-11-16 07:00:00,https://mma.prnewswire.com/media/1688762/Revolution_Capital_Revolution_Capital_Acquires_Grand_Financial_N.jpg?p=pdfthumbnail,"Acquisition broadens Revolution's factoring capabilities to service more clients in North America TORONTO, Nov. 16, 2021 /PRNewswire/ - Revolution...",2021-11-16
/news-releases/covid-changed-womens-shopping-behaviors-desires-and-expectations-according-to-new-national-study-from-meredith-and-the-harris-poll-301425114.html,"COVID Changed Women's Shopping Behaviors, Desires, And Expectations According To New National Study From Meredith And The Harris Poll",2021-11-16 07:00:00,https://mma.prnewswire.com/media/1689082/meredith_chart1_Infographic.jpg?p=thumbnail,"The COVID-19 pandemic has created space for women to reprioritize their energy and resources, including re-evaluating what matters most when it comes ...",2021-11-16
/news-releases/ambetter-from-sunflower-health-plan-health-adds-four-counties-to-kansas-insurance-coverage-301425105.html,Ambetter from Sunflower Health Plan Health Adds Four Counties to Kansas Insurance Coverage,2021-11-16 07:00:00,,"Open enrollment for the Health Insurance Marketplace in Kansas is running from Nov. 1, 2021, through Jan. 15, 2022. This year, Ambetter from...",2021-11-16
/news-releases/pedigree-technologies-now-offering-conmet-digital-products-to-provide-vehicle-health-data-in-real-time-301424731.html,Pedigree Technologies Now Offering ConMet Digital Products to Provide Vehicle Health Data in Real-Time,2021-11-16 07:00:00,https://mma.prnewswire.com/media/1688840/Digital_Pedigree_SmartProducts.jpg?p=thumbnail,"Today, Pedigree Technologies, a leading telematics service provider, announces the addition of ConMet's full suite of digital products into Pedigree...",2021-11-16
/news-releases/wishponds-persistiq-grows-sales-team-and-introduces-new-product-enhancements-and-service-packages-301425017.html,Wishpond's PersistIQ Grows Sales Team and Introduces New Product Enhancements and Service Packages,2021-11-16 07:00:00,https://mma.prnewswire.com/media/1689055/Wishpond_Technologies_Ltd__Wishpond_s_PersistIQ_Grows_Sales_Team.jpg?p=thumbnail,"Integration of PersistIQ business has been successful and the business is exceeding growth expectations VANCOUVER, BC, Nov. 16, 2021 /PRNewswire/ -...",2021-11-16
/news-releases/otc-markets-group-introduces-upgrades-to-qaravan-bank-analytics-platform-301424929.html,OTC Markets Group Introduces Upgrades to Qaravan Bank Analytics Platform,2021-11-16 07:00:00,https://mma.prnewswire.com/media/1394986/News_Update_Logo.jpg?p=thumbnail,"OTC Markets Group Inc. (OTCQX: OTCM), operator of financial markets for over 11,000 U.S. and global securities, today announced the launch of its...",2021-11-16
/news-releases/ambetter-from-magnolia-health-offers-health-insurance-in-63-counties-across-mississippi-301425119.html,Ambetter from Magnolia Health Offers Health Insurance in 63 Counties Across Mississippi,2021-11-16 07:00:00,,"Open enrollment for the Health Insurance Marketplace in Mississippi is running through January 15, 2022. This year, Ambetter from Magnolia Health is...",2021-11-16
/news-releases/turnspire-capital-partners-completes-acquisition-of-spectra-premium-301425172.html,Turnspire Capital Partners Completes Acquisition of Spectra Premium,2021-11-16 07:00:00,https://mma.prnewswire.com/media/1571530/Turnspire_Capital_Partners_Logo.jpg?p=thumbnail,"Turnspire Capital Partners LLC (""Turnspire"") announced today that a newly formed company, Spectra Premium Mobility Solutions, LLC (""Spectra"" or the...",2021-11-16
/news-releases/indiva-reports-third-quarter-fiscal-2021-results-301425046.html,Indiva Reports Third Quarter Fiscal 2021 Results,2021-11-16 07:00:00,https://mma.prnewswire.com/media/1689273/Indiva_Limited_Indiva_Reports_Third_Quarter_Fiscal_2021_Results.jpg?p=thumbnail,"Achieves Record Gross Margin, Positive Adjusted EBITDA and Continues to Lead the Edibles Category in Canada LONDON, ON, Nov. 16, 2021 /PRNewswire/ -...",2021-11-16
/news-releases/insights-on-the-aquatic-herbicides-global-market-to-2026---featuring-albaugh-basf-and-lonza-among-others-301425111.html,"Insights on the Aquatic Herbicides Global Market to 2026 - Featuring Albaugh, BASF and Lonza Among Others",2021-11-16 07:00:00,http://mma.prnewswire.com/media/539438/Research_and_Markets_Logo.jpg?p=thumbnail,"The ""Aquatic Herbicides Market Research Report by Method, Mode, Type, Application, and Region - Global Forecast to 2026 - Cumulative Impact of...",2021-11-16
/news-releases/otc-markets-group-welcomes-dolly-varden-silver-corporation-to-otcqx-301425147.html,OTC Markets Group Welcomes Dolly Varden Silver Corporation to OTCQX,2021-11-16 07:00:00,https://mma.prnewswire.com/media/1394985/Newly_Trading_Logo.jpg?p=thumbnail,"OTC Markets Group Inc. (OTCQX: OTCM), operator of financial markets for over 11,000 U.S. and global securities, today announced Dolly Varden Silver...",2021-11-16
/news-releases/pancea-is-making-pain-relief-available-at-your-fingertips-anywhere-anytime-301424900.html,"Pancea is making pain relief available at your fingertips anywhere, anytime",2021-11-16 07:00:00,https://mma.prnewswire.com/media/1688605/Pancea_Photo__1.jpg?p=thumbnail,"Pancea, a San Francisco digital health company, is utilizing software to tackle chronic musculoskeletal, MSK (neck, shoulder, lower back, and knee)...",2021-11-16
/news-releases/barclays-and-priceline-introduce-the-priceline-vip-rewards-visa-card-301424753.html,Barclays and Priceline Introduce the Priceline VIP Rewards™ Visa® Card,2021-11-16 07:00:00,https://mma.prnewswire.com/media/1688960/Priceline_VIP_Rewards__Visa__Card__Shatner_version.jpg?p=thumbnail,"Barclays and Priceline today announced the new Priceline VIP Rewards™ Visa® Card program, which provides cardmembers automatic Priceline VIP Gold...",2021-11-16
/news-releases/viatris-and-biocon-biologics-announce-launch-of-interchangeable-semglee-insulin-glargine-yfgn-injection-and-insulin-glargine-insulin-glargine-yfgn-injection-301425151.html,Viatris and Biocon Biologics Announce Launch of Interchangeable SEMGLEE® (insulin glargine-yfgn) Injection and Insulin Glargine (insulin glargine-yfgn) Injection,2021-11-16 06:59:00,https://mma.prnewswire.com/media/1499164/logo_Logo.jpg?p=thumbnail,Viatris Inc. (NASDAQ: VTRS) and Biocon Biologics Ltd. today announced the U.S. launch of interchangeable biosimilars SEMGLEE® (insulin glargine-yfgn) ...,2021-11-16
/news-releases/penske-automotive-group-acquires-mccoy-freightliner-301425069.html,Penske Automotive Group Acquires McCoy Freightliner,2021-11-16 06:59:00,https://mma.prnewswire.com/media/326905/penske_automotive_group_logo.jpg?p=thumbnail,"Penske Automotive Group, Inc. (NYSE: PAG), a diversified international transportation services company and one of the world's premier automotive and...",2021-11-16
/news-releases/treehouse-foods-publishes-annual-environmental-social--governance-report-301424681.html,"TreeHouse Foods Publishes Annual Environmental, Social & Governance Report",2021-11-16 06:55:00,,"TreeHouse Foods, Inc. (NYSE: THS) (""TreeHouse"" or ""the Company"") published its 2021 Environmental, Social & Governance (ESG) Report, which highlights ...",2021-11-16
/news-releases/edan-a-devoile-son-plan-d-action-pour-accelerer-le-deroulement-des-operations-cliniques-lors-du-salon-medica-2021-819400977.html,EDAN a dévoilé son plan d'action pour accélérer le déroulement des opérations cliniques lors du salon MEDICA 2021,2021-11-16 06:53:00,https://mma.prnewswire.com/media/1688379/image_1.jpg?p=thumbnail,"EDAN Instruments, Inc. (300206.SZ), une entreprise de premier plan axée sur les soins de santé dans les domaines de l'obstétrique et de la...",2021-11-16
/news-releases/olin-corporation-announces-early-tender-results-and-upsize-of-cash-tender-offer-and-solicitation-of-consents-relating-to-its-9-500-senior-notes-due-2025--301424748.html,Olin Corporation Announces Early Tender Results and Upsize of Cash Tender Offer and Solicitation of Consents Relating to its 9.500% Senior Notes due 2025,2021-11-16 06:50:00,https://mma.prnewswire.com/media/717484/OlinLogo.jpg?p=thumbnail,"Olin Corporation (the ""Issuer,"" ""us"" or ""we"") (NYSE: OLN) today announced the early tender results of its offer to purchase (the ""Offer"") for cash a...",2021-11-16
/news-releases/provident-healthcare-partners-advises-scott--christie-eyecare-associates-in-its-affiliation-with-eyesouth-partners-301424760.html,Provident Healthcare Partners Advises Scott & Christie EyeCare Associates In Its Affiliation With EyeSouth Partners,2021-11-16 06:48:00,https://mma.prnewswire.com/media/466385/Provident_Logo.jpg?p=thumbnail,"Provident Healthcare Partners (""Provident""), a leading healthcare investment banking firm, announced that it has advised Scott & Christie EyeCare...",2021-11-16
/news-releases/sk-inc-enters-into-exclusive-financing-deal-with-the-center-for-breakthrough-medicines-301425192.html,SK Inc. Enters into Exclusive Financing Deal with the Center for Breakthrough Medicines,2021-11-16 06:46:00,https://mma.prnewswire.com/media/1446747/The_Discovery_Labs_Center_for_Breakthrough_Medicines_Logo.jpg?p=thumbnail,"The Center for Breakthrough Medicines (CBM) announced today that it has entered into exclusive negotiations with SK Inc., significantly accelerating...",2021-11-16
/news-releases/target-hospitality-strengthens-focus-on-government-services-diversification-with-strategic-board-appointment-301424630.html,Target Hospitality Strengthens Focus on Government Services Diversification with Strategic Board Appointment,2021-11-16 06:45:00,,"Target Hospitality Corp. (""Target Hospitality"", ""Target"" or the ""Company"") (NASDAQ: TH), North America's largest provider of vertically integrated...",2021-11-16
/news-releases/worldwide-pharmaceutical-vials-industry-to-2030---key-trends-and-forecasts-301425144.html,Worldwide Pharmaceutical Vials Industry to 2030 - Key Trends and Forecasts,2021-11-16 06:45:00,https://mma.prnewswire.com/media/539438/Research_and_Markets_Logo.jpg?p=thumbnail,"The ""Global Pharmaceutical Vials Market - Distribution by Type of Fabrication Material Used, Sterilization Status and Key Geographies - Industry...",2021-11-16
/news-releases/greenidge-generation-publishes-updated-corporate-presentation-301425170.html,Greenidge Generation Publishes Updated Corporate Presentation,2021-11-16 06:45:00,,"Greenidge Generation Holdings Inc. (NASDAQ: GREE) (""Greenidge"") announced today that it has published an updated corporate presentation with an...",2021-11-16
/news-releases/international-game-technology-plc-hosting-2021-investor-day-today-301424837.html,International Game Technology PLC Hosting 2021 Investor Day Today,2021-11-16 06:40:00,https://mma.prnewswire.com/media/453980/IGT_Logo.jpg?p=thumbnail,"International Game Technology PLC (""IGT"") (NYSE:IGT) will host a virtual Investor Day today at 8:30 am EST, detailing the progress the Company has...",2021-11-16
/news-releases/from-the-tax-law-offices-of-david-w-klasing--federal-court-holds-irs-foreign-bank-account-reporting-penalties-can-now-exceed-the-regulatory-cap-301425056.html,From the Tax Law Offices of David W. Klasing - Federal Court holds: IRS Foreign Bank Account Reporting Penalties Can Now Exceed the Regulatory Cap,2021-11-16 06:37:00,https://i.ytimg.com/vi/f6Td79npgCs/hqdefault.jpg,"The IRS has gotten into the habit of assessing and enforcing harsh Foreign Bank Account Reporting ""FBAR"" penalties in the recent past. But statutory...",2021-11-16
/news-releases/opera-limited-to-participate-at-the-mkm-partners-virtual-conference-301425178.html,Opera Limited to participate at the MKM Partners Virtual Conference,2021-11-16 06:36:00,https://mma.prnewswire.com/media/1441977/Opera_Logo.jpg?p=thumbnail,"Opera Limited (NASDAQ: OPRA), one of the world's major browser developers and a leading internet consumer brand, announced today that Frode Jacobsen, ...",2021-11-16
/news-releases/walker--dunlop-launches-new-lending-platform-301424876.html,Walker & Dunlop Launches New Lending Platform,2021-11-16 06:35:00,https://mma.prnewswire.com/media/463180/Walker_and_Dunlop_Logo.jpg?p=thumbnail,"Walker & Dunlop, Inc. announced today the launch of a new digital lending platform powered by machine learning to dramatically grow its small balance ...",2021-11-16
/news-releases/mplx-lp-announces-binding-open-season-for-tesoro-high-plains-pipeline-company-llc-301425082.html,MPLX LP Announces Binding Open Season For Tesoro High Plains Pipeline Company LLC,2021-11-16 06:30:00,,"MPLX announced today that its subsidiary, Tesoro High Plains Pipeline Company LLC (""THPP""), has launched a binding open season to assess shipper...",2021-11-16
/news-releases/cyclic-olefin-copolymers-market-to-expand-at-cagr-of-5-growing-demand-for-multiple-applications-in-medical-sector-to-drive-demand-states-tmr-report-301424885.html,"Cyclic Olefin Copolymers Market to Expand at CAGR of 5%; Growing Demand for Multiple Applications in Medical Sector to Drive Demand, States TMR Report",2021-11-16 06:30:00,https://mma.prnewswire.com/media/1682871/TMR_Logo_Logo.jpg?p=thumbnail,"The rising use of cyclic olefin copolymers due to their exceptional optical properties, superior dimensional ability, and reliable chemical and heat...",2021-11-16
/news-releases/automotive-turbocharger-market-worth-19-2-billion-by-2026--exclusive-report-by-marketsandmarkets-301425019.html,Automotive Turbocharger Market worth $19.2 billion by 2026 - Exclusive Report by MarketsandMarkets™,2021-11-16 06:30:00,https://mma.prnewswire.com/media/660509/MarketsandMarkets_Logo.jpg?p=thumbnail,"According to the new market research report ""Automotive Turbocharger Market by Technology (VGT, Wastegate, Electric), Material (Cast Iron, Aluminum), ...",2021-11-16
/news-releases/outlook-on-the-novel-ocular-drug-delivery-devices-global-market-to-2030---industry-trends-and-forecasts-301425132.html,Outlook on the Novel Ocular Drug Delivery Devices Global Market to 2030 - Industry Trends and Forecasts,2021-11-16 06:30:00,https://mma.prnewswire.com/media/539438/Research_and_Markets_Logo.jpg?p=thumbnail,"The ""Novel Ocular Drug Delivery Devices Market: Focus on Implants, Inserts and Punctal Plugs - Distribution by Type of Drug Delivery Device, Target...",2021-11-16
/news-releases/azz-inc-to-present-at-the-13th-annual-southwest-ideas-investor-conference-on-november-17-2021-301424850.html,"AZZ Inc. to Present at the 13th Annual Southwest IDEAS Investor Conference on November 17, 2021",2021-11-16 06:30:00,https://mma.prnewswire.com/media/559731/AZZ_Inc_Logo.jpg?p=thumbnail,"AZZ Inc. (NYSE: AZZ), a global provider of galvanizing and metal coating solutions, welding solutions, specialty electrical equipment and highly...",2021-11-16
/news-releases/viavi-announces-3d-network-observability-spanning-saas-on-premises-and-remote-environments-301425070.html,"VIAVI Announces 3D Network Observability Spanning SaaS, On-Premises and Remote Environments",2021-11-16 06:30:00,https://mma.prnewswire.com/media/386858/Viavi_Logo.jpg?p=thumbnail,"Viavi Solutions Inc. (VIAVI) (NASDAQ: VIAV) today released Observer 3D v18.6, enhancing the comprehensive network performance and monitoring (NPM)...",2021-11-16
/news-releases/the-glycomark-test-is-more-accurate-than-hba1c-and-glucose-for-predicting-mortality-in-diabetic-and-non-diabetic-covid-19-patients-301424410.html,The GlycoMark® Test is More Accurate than HbA1c and Glucose for Predicting Mortality in Diabetic and Non-Diabetic COVID-19 Patients,2021-11-16 06:30:00,https://mma.prnewswire.com/media/1277045/Precision_Diabetes_Logo.jpg?p=thumbnail,"Precision Diabetes, Inc. today announces the presentation of data demonstrating that the 1,5-anhydroglucitol blood test (GlycoMark®) is more accurate ...",2021-11-16
/news-releases/ituran-location-and-control-ltd-presents-results-for-the-third-quarter-of-2021-301425115.html,Ituran Location and Control Ltd. Presents Results for the Third Quarter of 2021,2021-11-16 06:30:00,,"Ituran Location and Control Ltd. (NASDAQ: ITRN), today announced its consolidated financial results for the third quarter of 2021. Highlights of the...",2021-11-16
/news-releases/edan-revelo-su-plan-para-acelerar-el-flujo-de-trabajo-de-la-clinica-en-medica-2021-851680406.html,EDAN reveló su plan para acelerar el flujo de trabajo de la clínica en MEDICA 2021,2021-11-16 06:30:00,https://mma.prnewswire.com/media/1688379/image_1.jpg?p=thumbnail,"EDAN Instruments, Inc. (300206.SZ), una compañía líder en el cuidado de la salud en el campo de la obstetricia y ginecología, diagnóstico de ECG,...",2021-11-16
/news-releases/los-budistas-abren-espacios-de-dialogo-durante-la-cop26-e-invitan-a-reforzar-el-liderazgo-de-los-jovenes-y-la-educacion-825812720.html,Los budistas abren espacios de diálogo durante la COP26 e invitan a reforzar el liderazgo de los jóvenes y la educación,2021-11-16 06:28:00,,"Entre el 1.o y 7 de noviembre, la primera semana de la Conferencia de las Naciones Unidas sobre el Cambio Climático COP26 que se celebra en Glasgow,...",2021-11-16
/news-releases/earthoptics-launches-new-soil-carbon-project-labeling-to-help-consumers-choose-climate-smart-products-301425127.html,EarthOptics Launches New Soil Carbon Project Labeling to Help Consumers Choose Climate-Smart Products,2021-11-16 06:15:00,https://mma.prnewswire.com/media/1689164/EarthOptics_GroundOwlSensors.jpg?p=thumbnail,"The first-of-its-kind agtech company leveraging machine learning (ML) to advance measurement and analysis of soil properties, EarthOptics announced...",2021-11-16
/news-releases/loftware-nicelabel-10-offre-une-meilleure-visibilite-un-gain-de-temps-et-une-gestion-simplifiee-grace-a-l-etiquetage-base-sur-le-cloud-821253866.html,"Loftware NiceLabel 10 offre une meilleure visibilité, un gain de temps et une gestion simplifiée grâce à l'étiquetage basé sur le cloud",2021-11-16 06:15:00,https://mma.prnewswire.com/media/1658239/Loftware_Logo.jpg?p=thumbnail,"Loftware Inc., le plus grand éditeur mondial de logiciels spécialisé dans les solutions d'étiquetage d'entreprise et de gestion des illustrations, a...",2021-11-16
/news-releases/loftware-nicelabel-10-proporciona-mayor-visibilidad-ahorro-de-tiempo-y-gestion-racionalizada-844068029.html,"Loftware NiceLabel 10 proporciona mayor visibilidad, ahorro de tiempo y gestión racionalizada",2021-11-16 06:15:00,https://mma.prnewswire.com/media/1658239/Loftware_Logo.jpg?p=thumbnail,"Loftware Inc., la mayor empresa mundial de software especializada en soluciones de Etiquetado Empresarial y Gestión de Material Gráfico, anunció hoy...",2021-11-16
/news-releases/global-biological-organic-fertilizers-market-2021-to-2027---featuring-national-fertilizers-seek-biotechnology-and-coromandel-international-among-others-301425112.html,"Global Biological Organic Fertilizers Market (2021 to 2027) - Featuring National Fertilizers, Seek Biotechnology and Coromandel International Among Others",2021-11-16 06:15:00,https://mma.prnewswire.com/media/539438/Research_and_Markets_Logo.jpg?p=thumbnail,"The ""Biological Organic Fertilizers Market Global Forecast 2021-2027, Industry Trends, Share, Insight, Impact of COVID-19, Opportunity Company...",2021-11-16
/news-releases/loftware-nicelabel-10-bietet-mehr-transparenz-zeitersparnis-und-optimierte-verwaltung-mit-cloud-basierter-etikettierung-840459398.html,"Loftware NiceLabel 10 bietet mehr Transparenz, Zeitersparnis und optimierte Verwaltung mit Cloud-basierter Etikettierung",2021-11-16 06:15:00,https://mma.prnewswire.com/media/1658239/Loftware_Logo.jpg?p=thumbnail,"Loftware Inc., das größte globale Softwareunternehmen, das sich auf Enterprise Labeling und Artwork Management-Lösungen spezialisiert hat, kündigte...",2021-11-16
/news-releases/zoup-launches-super-premium-culinary-concentrates-301423249.html,Zoup! Launches Super-Premium Culinary Concentrates™,2021-11-16 06:15:00,https://mma.prnewswire.com/media/1687286/Zoup__Good__Really_Good__Logo.jpg?p=thumbnail,"This Thanksgiving, Zoup! is continuing to elevate the broth category with its introduction of Zoup! Good, Really Good® Culinary Concentrates™....",2021-11-16
/news-releases/loftware-nicelabel-10-provides-greater-visibility-time-savings-and-streamlined-management-with-cloud-based-labeling-301422997.html,"Loftware NiceLabel 10 Provides Greater Visibility, Time Savings and Streamlined Management with Cloud-Based Labeling",2021-11-16 06:15:00,https://mma.prnewswire.com/media/1658239/Loftware_Logo.jpg?p=thumbnail,"Loftware Inc., the largest global software company specializing in Enterprise Labeling and Artwork Management solutions, today announced Loftware...",2021-11-16
/news-releases/mb2-dental-adds-33rd-state-idaho-301424832.html,MB2 Dental Adds 33rd State: Idaho,2021-11-16 06:10:00,https://mma.prnewswire.com/media/1689204/MB2_Dental_Adds_33rd_State_Idaho_Logo.jpg?p=thumbnail,"MB2 Dental, the first-ever Dental Partnership Organization, has expanded its territory into Idaho. MB2 partnered with Dr. Scott Lyman, owner of Green ...",2021-11-16
/news-releases/the-international-beauty-conference-in-sanya-to-showcase-global-beauty-forerunners-301425131.html,The International Beauty Conference in Sanya to Showcase Global Beauty Forerunners,2021-11-16 06:09:00,https://mma.prnewswire.com/media/1689582/IBSC.jpg?p=thumbnail,"In Sanya, Hainan Province, China, the first Hainan International Beauty Selection Conference will be held from April 16 to 18, 2022, according to the ...",2021-11-16
/news-releases/sheevaai-announces-follow-on-investment-from-conscious-venture-partners-301425051.html,Sheeva.AI Announces Follow-On Investment from Conscious Venture Partners,2021-11-16 06:05:00,,Sheeva.AI today announced it has closed a follow-on investment from Conscious Venture Partners (CVP) through their Conscious Venture Fund II...,2021-11-16
/news-releases/performio-releases-new-commission-software-functionality-and-announces-global-partnership-with-opensymmetry-301424960.html,Performio Releases New Commission Software Functionality and Announces Global Partnership with OpenSymmetry,2021-11-16 06:05:00,https://mma.prnewswire.com/media/1688733/Performio_Partnership_Announcement.jpg?p=thumbnail,"Performio, the leading enterprise-grade sales commission software solution, has announced that it has recently released important new product...",2021-11-16
/news-releases/movember-develops-first-ever-social-impact-media-accelerator-for-black-creators-301424991.html,Movember Develops First Ever Social Impact Media Accelerator For Black Creators,2021-11-16 06:03:00,https://mma.prnewswire.com/media/1689208/ROOTED_AND_RISING_IMAGE.jpg?p=thumbnail,"Movember, the leading global men's health charity has launched its first ever media accelerator for Black creatives. The inaugural Rooted and Rising...",2021-11-16
/news-releases/restoring-lives-through-the-outdoors-iron-valley-supply-co-supports-the-veterans-afield-foundation-301424944.html,Restoring Lives Through the Outdoors: Iron Valley™ Supply Co. Supports The Veterans Afield Foundation,2021-11-16 06:03:00,https://mma.prnewswire.com/media/1689363/Iron_Valley_Supply_video.mp4?p=medium,"Iron Valley™ Supply Co. proudly supports our nations' Combat Veterans, Gold Star Families and First-Responders by sponsoring The Veterans Afield...",2021-11-16
